id,title,release_date,popularity,vote_average,vote_count,genre_ids,overview,original_language,release_year
278927,The Jungle Book,2016-04-07,7.6156,6.871,8470,"[10751, 12, 14]","After a threat from the tiger Shere Khan, Mowgli, a man-cub fostered by wolves, is forced to flee the jungle, and he embarks on a journey of self-discovery with the help of the panther, Bagheera, and the free-spirited bear, Baloo.",en,2016
60308,Moneyball,2011-09-23,7.7962,7.289,5727,[18],"The story of Oakland Athletics general manager Billy Beane's successful attempt to put together a baseball team on a budget, by employing computer-generated analysis to draft his players.",en,2011
43949,Flipped,2010-08-06,7.9991,8.006,3304,"[10749, 18]","When Juli meets Bryce in the second grade, she knows it's true love. After spending six years trying to convince Bryce the same, she's ready to give up - until he starts to reconsider.",en,2010
504056,Big Brother,2018-08-16,7.0367,7.439,254,"[28, 18, 35]","A soldier-turned-high school teacher uses unusual methods to reach to a class of poor students, while dealing with a greedy entrepreneur and his gang of fighters as well as the government.",zh,2018
884,Crash,1996-07-17,7.9324,6.464,1326,"[53, 18]",A car crash victim suddenly finds himself turned on by car accidents and becomes involved with an underground sub-culture of like-minded souls.,en,1996
10895,Pinocchio,1940-02-23,7.1427,7.108,6223,"[16, 10751, 14]","When the gentle woodcarver Geppetto builds a marionette to be his substitute son, a benevolent fairy brings the toy to life. The puppet, named Pinocchio, is not yet a human boy. He must earn the right to be real by proving that he is brave, truthful, and unselfish.",en,1940
7555,Rambo,2008-01-24,7.8675,6.695,4248,"[28, 53, 10752]","In Thailand, ex-Green Beret John James Rambo joins a group of mercenaries to venture into war-torn neighboring Myanmar to rescue a group of Christian aid workers who have been kidnapped by a ruthless local infantry unit.",en,2008
317442,The Last: Naruto the Movie,2014-12-06,6.769,7.468,2386,"[28, 10749, 16]","Two years after the events of the Fourth Great Ninja War, the moon that Hagoromo Otsutsuki created long ago to seal away the Gedo Statue begins to descend towards the world, threatening to become a meteor that would destroy everything on impact. Amidst this crisis, a direct descendant of Kaguya Otsutsuki named Toneri Otsutsuki attempts to kidnap Hinata Hyuga but ends up abducting her younger sister Hanabi. Naruto and his allies now mount a rescue mission before finding themselves embroiled in a final battle to decide the fate of everything.",ja,2014
19913,(500) Days of Summer,2009-07-17,7.4399,7.3,10983,"[35, 18, 10749]","Tom, greeting-card writer and hopeless romantic, is caught completely off-guard when his girlfriend, Summer, suddenly dumps him. He reflects on their 500 days together to try to figure out where their love affair went sour, and in doing so, Tom rediscovers his true passions in life.",en,2009
11362,The Count of Monte Cristo,2002-01-23,7.772,7.673,2006,"[12, 18, 36, 28, 53]","Edmond Dantés's life and plans to marry the beautiful Mercedes are shattered when his best friend, Fernand, deceives him. After spending 13 miserable years in prison, Dantés escapes with the help of a fellow inmate and plots his revenge, cleverly insinuating himself into the French nobility.",en,2002
11713,Fist of Fury,1972-03-22,7.7677,7.225,1064,"[18, 28, 53]","During the Japanese occupation of Shanghai, Chen Zhen, the star pupil of a recently-deceased martial arts teacher battles a Japanese dojo which seeks the demise of his fighting school.",zh,1972
10404,Raise the Red Lantern,1991-12-18,5.5201,7.915,797,[18],"In 1920s China, 19-year-old Songlian becomes a concubine of a powerful lord and is forced to compete with his three wives for the privileges gained.",zh,1991
8009,Highlander,1986-03-07,7.9689,6.862,2890,"[12, 28, 14]",He fought his first battle on the Scottish Highlands in 1536. He will fight his greatest battle on the streets of New York City in 1986. His name is Connor MacLeod. He is immortal.,en,1986
184345,A Haunted House 2,2014-04-17,7.5629,6.175,1579,"[35, 27]","After exorcising the demons of his ex, Malcolm starts afresh with his new girlfriend and her two children. After moving into their dream home, Malcolm is once again plagued by bizarre paranormal events.",en,2014
9444,Anastasia,1997-11-20,7.6778,7.608,5598,"[16, 10751, 14, 12]","Ten years after she was separated from her family, an eighteen-year-old orphan with vague memories of the past sets out to Paris in hopes of reuniting with her grandmother. She is accompanied by two con men, who intend to pass her off as the Grand Duchess Anastasia to the Dowager Empress for a reward.",en,1997
661374,Glass Onion: A Knives Out Mystery,2022-11-23,7.8286,7.032,6763,"[35, 80, 9648]",World-famous detective Benoit Blanc heads to Greece to peel back the layers of a mystery surrounding a tech billionaire and his eclectic crew of friends.,en,2022
87428,That's My Boy,2012-06-14,7.8429,5.803,2141,[35],"While in his teens, Donny fathered a son, Todd, and raised him as a single parent up until Todd's 18th birthday. Now, after not seeing each other for years, Todd's world comes crashing down when Donny resurfaces just before Todd's wedding.",en,2012
785084,The Whale,2022-12-09,7.9369,7.772,4643,[18],A reclusive English teacher suffering from severe obesity attempts to reconnect with his estranged teenage daughter for one last chance at redemption.,en,2022
9023,Spirit: Stallion of the Cimarron,2002-05-24,7.6693,7.686,4868,"[16, 12, 10751, 18, 37]",A captured mustang remains determined to return to his herd no matter what.,en,2002
81188,Rise of the Guardians,2012-11-21,7.628,7.372,7117,"[16, 10751, 14, 28, 12]","When an evil spirit known as Pitch lays down the gauntlet to take over the world, the immortal Guardians must join forces for the first time to protect the hopes, beliefs and imagination of children all over the world.",en,2012
628,Interview with the Vampire,1994-11-11,7.5309,7.387,6393,"[27, 18, 14]","A vampire relates his epic life story of love, betrayal, loneliness, and dark hunger to an over-curious reporter.",en,1994
28178,Hachi: A Dog's Tale,2009-06-08,6.6611,8.006,7151,"[18, 10751]","Professor Wilson discovers a lost Akita puppy on his way home. Despite objections from his wife, Hachi endears himself to the family and grows to be Parker's loyal companion. As their bond grows deeper, a beautiful relationship unfolds.",en,2009
956,Mission: Impossible III,2006-04-25,7.7179,6.8,7577,"[12, 28, 53]","Retired from active duty, and training recruits for the Impossible Mission Force, agent Ethan Hunt faces the toughest foe of his career: Owen Davian, an international broker of arms and information, who's as cunning as he is ruthless. Davian emerges to threaten Hunt and all that he holds dear – including the woman Hunt loves.",en,2006
9693,Children of Men,2006-09-22,7.5974,7.6,7797,"[878, 53, 28]","In 2027, in a chaotic world in which humans can no longer procreate, a former activist agrees to help transport a miraculously pregnant woman to a sanctuary at sea, where her child's birth may help scientists save the future of humankind.",en,2006
879,Hook,1991-04-10,6.7462,6.841,5706,"[12, 14, 35, 10751]","The boy who wasn't supposed to grow up—Peter Pan—does just that, becoming a soulless corporate lawyer whose workaholism could cost him his wife and kids. During his trip to see Granny Wendy in London, the vengeful Capt. Hook kidnaps Peter's kids and forces Peter to return to Neverland.",en,1991
9603,Clueless,1995-07-19,7.6625,7.251,4779,"[35, 10749]","Shallow, rich and socially successful Cher is at the top of her Beverly Hills high school's pecking scale. Seeing herself as a matchmaker, Cher first coaxes two teachers into dating each other. Emboldened by her success, she decides to give hopelessly klutzy new student Tai a makeover. When Tai becomes more popular than she is, Cher realizes that her disapproving ex-stepbrother was right about how misguided she was -- and falls for him.",en,1995
335977,Indiana Jones and the Dial of Destiny,2023-06-25,7.6466,6.513,4117,"[12, 28]","Finding himself in a new era, and approaching retirement, Indy wrestles with fitting into a world that seems to have outgrown him. But as the tentacles of an all-too-familiar evil return in the form of an old rival, Indy must don his hat and pick up his whip once more to make sure an ancient and powerful artifact doesn't fall into the wrong hands.",en,2023
2270,Stardust,2007-08-10,7.8051,7.288,4421,"[12, 14, 10749, 10751]","In a countryside town bordering on a magical land, a young man makes a promise to his beloved that he'll retrieve a fallen star by venturing into the magical realm. His journey takes him into a world beyond his wildest dreams and reveals his true identity.",en,2007
26466,Triangle,2009-10-16,7.1552,6.922,2943,[27],"When Jess sets sail on a yacht with a group of friends, she cannot shake the feeling that there is something wrong.",en,2009
508642,Gonjiam: Haunted Asylum,2018-03-28,8.4715,7.274,911,"[27, 9648]","The crew of a horror web series travels to an abandoned asylum for a live broadcast, but they encounter much more than expected as they move deeper inside the nightmarish old building.",ko,2018
22803,Law Abiding Citizen,2009-10-15,6.9975,7.387,5636,"[18, 80, 53]",A frustrated man decides to take justice into his own hands after a plea bargain sets one of his family's killers free. He targets not only the killer but also the district attorney and others involved in the deal.,en,2009
495764,Birds of Prey (and the Fantabulous Emancipation of One Harley Quinn),2020-02-05,7.5534,6.878,10777,"[28, 80]","Harley Quinn joins forces with a singer, an assassin and a police detective to help a young girl who had a hit placed on her after she stole a rare diamond from a crime lord.",en,2020
11969,Tombstone,1993-12-25,7.0892,7.582,2433,"[37, 28]","Legendary marshal Wyatt Earp, now a weary gunfighter, joins his brothers Morgan and Virgil to pursue their collective fortune in the thriving mining town of Tombstone. But Earp is forced to don a badge again and get help from his notorious pal Doc Holliday when a gang of renegade brigands and rustlers begins terrorizing the town.",en,1993
279,Amadeus,1984-09-19,7.2207,8.023,4733,"[36, 10402, 18]",Disciplined Italian composer Antonio Salieri becomes consumed by jealousy and resentment towards the hedonistic and remarkably talented young Salzburger composer Wolfgang Amadeus Mozart.,en,1984
636706,Spaceman,2024-02-23,6.6772,6.705,1030,"[878, 12, 18]","Six months into a solo mission, a lonely astronaut confronts the cracks in his marriage with help from a mysterious creature he discovers on his ship.",en,2024
9802,The Rock,1996-06-07,7.6768,7.144,5169,"[28, 12, 53]","When vengeful General Francis X. Hummel seizes control of Alcatraz Island and threatens to launch missiles loaded with deadly chemical weapons into San Francisco, only a young FBI chemical weapons expert and notorious Federal prisoner have the skills to penetrate the impregnable island fortress and take him down.",en,1996
180,Minority Report,2002-06-20,7.8132,7.353,9572,"[878, 28, 53]","John Anderton is a top 'Precrime' cop in the late-21st century, when technology can predict crimes before they're committed. But Anderton becomes the quarry when another investigator targets him for a murder charge.",en,2002
739405,Operation Fortune: Ruse de Guerre,2023-01-04,7.0639,6.462,1920,"[28, 35, 53, 12]",Special agent Orson Fortune and his team of operatives recruit one of Hollywood's biggest movie stars to help them on an undercover mission when the sale of a deadly new weapons technology threatens to disrupt the world order.,en,2023
400928,Gifted,2017-04-07,7.5801,7.996,5915,"[18, 35]","Frank, a single man raising his child prodigy niece Mary, is drawn into a custody battle with his mother.",en,2017
300671,13 Hours: The Secret Soldiers of Benghazi,2016-01-14,7.6027,7.27,3919,"[10752, 28, 36, 18, 53]",An American Ambassador is killed during an attack at a U.S. compound in Libya as a security team struggles to make sense out of the chaos.,en,2016
401981,Red Sparrow,2018-02-15,7.9367,6.534,6340,"[53, 9648]","Prima ballerina Dominika Egorova faces a bleak and uncertain future after she suffers an injury that ends her career. She soon turns to Sparrow School, a secret intelligence service that trains exceptional young people to use their minds and bodies as weapons. Dominika emerges as the most dangerous Sparrow after completing the sadistic training process. As she comes to terms with her new abilities, she meets a CIA agent who tries to convince her that he is the only person she can trust.",en,2018
241259,Alice Through the Looking Glass,2016-05-25,7.0812,6.562,6756,"[12, 10751, 14]",Alice Kingsleigh returns to Underland and faces a new adventure in saving the Mad Hatter.,en,2016
4922,The Curious Case of Benjamin Button,2008-12-25,7.5121,7.598,13666,"[18, 14, 10749]","Born under unusual circumstances, Benjamin Button springs into being as an elderly man in a New Orleans nursing home and ages in reverse. Twelve years after his birth, he meets Daisy, a child who flits in and out of his life as she grows up to be a dancer. Though he has all sorts of unusual adventures over the course of his life, it is his relationship with Daisy, and the hope that they will come together at the right time, that drives Benjamin forward.",en,2008
1126166,Flight Risk,2025-01-22,7.2464,5.94,1144,"[28, 53]","A pilot transports a U.S. Marshal accompanying a government witness to a trial in New York. As they cross the Alaskan wilderness, tensions soar and trust is tested, as not everyone on board is who they seem.",en,2025
11619,Flushed Away,2006-10-22,6.6694,6.318,4071,"[12, 16, 35, 10751]","London high-society mouse, Roddy is flushed down the toilet by Sid, a common sewer rat. Hang on for a madcap adventure deep in the sewer bowels of Ratropolis, where Roddy meets the resourceful Rita, the rodent-hating Toad and his faithful thugs, Spike and Whitey.",en,2006
13448,Angels & Demons,2009-04-20,7.7122,6.719,7292,"[53, 9648]","Harvard symbologist Robert Langdon is recruited by the Vatican to investigate the apparent return of the Illuminati – a secret, underground organization – after four cardinals are kidnapped on the night of the papal conclave.",en,2009
12244,9,2009-08-19,7.6121,6.948,3851,"[28, 12, 16, 878, 53]","When 9 first comes to life, he finds himself in a post-apocalyptic world. All humans are gone, and it is only by chance that he discovers a small community of others like him taking refuge from fearsome machines that roam the earth intent on their extinction. Despite being the neophyte of the group, 9 convinces the others that hiding will do them no good.",en,2009
346910,The Predator,2018-09-05,7.841,5.624,5121,"[878, 28, 53]","When a young boy accidentally triggers the universe's most lethal hunters' return to Earth, only a ragtag crew of ex-soldiers and a disgruntled scientist can prevent the end of the human race.",en,2018
9297,Monster House,2006-06-30,7.7057,6.71,4309,"[16, 35, 10751, 14]","Monsters under the bed are scary enough, but what happens when an entire house is out to get you? Three teens aim to find out when they go up against a decrepit neighboring home and unlock its frightening secrets.",en,2006
605722,Long Distance,2024-07-12,8.0416,6.435,245,"[878, 35, 28]","After crash-landing on an alien planet, an asteroid miner must contend with the challenges of his new surroundings, while making his way across the harsh terrain to the only other survivor – a woman who is trapped in her escape pod.",en,2024
686,Contact,1997-07-11,7.6051,7.441,4957,"[18, 878, 9648]","A radio astronomer receives the first extraterrestrial radio signal ever picked up on Earth. As the world powers scramble to decipher the message and decide upon a course of action, she must make some difficult decisions between her beliefs, the truth, and reality.",en,1997
508,Love Actually,2003-09-07,6.9265,7.096,7360,"[35, 10749, 18]",Eight very different couples deal with their love lives in various loosely interrelated tales all set during a frantic month before Christmas in London.,en,2003
76,Before Sunrise,1995-01-27,7.5855,7.974,4655,"[18, 10749]","An unexpected meeting on a train leads two travelers to spend an evening wandering through Vienna. As the night unfolds, they share stories and conversations about life and love, exploring new ideas while a quiet intimacy grows between them, knowing it may be their only night together.",en,1995
9792,The Hills Have Eyes,2006-03-10,7.7205,6.458,3316,"[27, 53]","Based on Wes Craven's 1977 suspenseful cult classic, The Hills Have Eyes is the story of a family road trip that goes terrifyingly awry when the travelers become stranded in a government atomic zone. Miles from nowhere, the Carter family soon realizes the seemingly uninhabited wasteland is actually the breeding ground of a blood-thirsty mutant family...and they are the prey.",en,2006
9426,The Fly,1986-08-15,7.788,7.43,4940,"[27, 878]","When Seth Brundle makes a huge scientific and technological breakthrough in teleportation, he decides to test it on himself. Unbeknownst to him, a common housefly manages to get inside the device and the two become one.",en,1986
14262,Desperate Living,1977-05-27,7.4197,6.435,116,"[35, 80]","After killing her husband, Peggy Gravel and her murderous maid Grizelda wind up in the crazy town of Mortville, where Queen Carlotta presides over a sleazy collection of misfits.",en,1977
4347,Atonement,2007-02-27,7.6267,7.6,4677,"[18, 10749]",A young girl irrevocably changes the course of several lives when she accuses her older sister's lover of a crime he did not commit.,en,2007
76757,Jupiter Ascending,2015-02-04,7.5126,5.462,7081,"[878, 14, 28]","In a universe where human genetic material is the most precious commodity, an impoverished young Earth woman becomes the key to strategic maneuvers and internal strife within a powerful dynasty…",en,2015
300668,Annihilation,2018-02-22,8.2846,6.441,9319,"[878, 27]","A biologist signs up for a dangerous, secret expedition into a mysterious zone where the laws of nature don't apply.",en,2018
281338,War for the Planet of the Apes,2017-07-11,7.8939,7.218,9681,"[18, 878, 10752]","Caesar and his apes are forced into a deadly conflict with an army of humans led by a ruthless Colonel. After the apes suffer unimaginable losses, Caesar wrestles with his darker instincts and begins his own mythic quest to avenge his kind. As the journey finally brings them face to face, Caesar and the Colonel are pitted against each other in an epic battle that will determine the fate of both their species and the future of the planet.",en,2017
414419,Kill Bill: The Whole Bloody Affair,2011-03-27,7.6392,8.1,1228,"[28, 80]","A former assassin, known simply as The Bride, wakes from a coma four years after her jealous ex-lover Bill attempts to murder her on her wedding day. Fueled by an insatiable desire for revenge, she vows to get even with every person who contributed to the loss of her unborn child, her entire wedding party, and four years of her life. After devising a hit list, The Bride sets off on her quest, enduring unspeakable injury and unscrupulous enemies.",en,2011
82695,Les Misérables,2012-12-18,7.9181,7.307,5560,"[36, 18]","An adaptation of the successful stage musical based on Victor Hugo's classic novel set in 19th-century France. Jean Valjean, a man imprisoned for stealing bread, must flee a relentless policeman named Javert. The pursuit consumes both men's lives, and soon Valjean finds himself in the midst of the student revolutions in France.",en,2012
1369,Rambo: First Blood Part II,1985-05-21,7.9344,6.659,4292,"[28, 12, 53, 10752]",John Rambo is released from prison by the government for a top-secret covert mission to the last place on Earth he'd want to return - the jungles of Vietnam.,en,1985
127380,Finding Dory,2016-06-16,6.9288,7.039,12620,"[12, 16, 10751]",Dory is reunited with her friends Nemo and Marlin in the search for answers about her past. What can she remember? Who are her parents? And where did she learn to speak Whale?,en,2016
842924,The Life of Chuck,2025-06-05,12.4271,7.286,1049,"[14, 18]","In this extraordinary story of an ordinary man, Charles 'Chuck' Krantz experiences the wonder of love, the heartbreak of loss, and the multitudes contained in all of us.",en,2025
513434,One Cut of the Dead,2017-11-04,5.3232,7.627,968,"[35, 27, 18]","Real zombies arrive and terrorize the crew of a zombie film being shot in an abandoned warehouse, said to be the site of military experiments on humans.",ja,2017
122126,The Concubine,2012-06-06,7.24,5.8,110,[18],"Living a torturous life of poverty and barely able to survive, Hwa-yeon decides to offer herself as one of the king’s concubines. Once inside the royal palace, two men are immediately seized by the woman - the Grand Prince Seong-won, a megalomaniacal ruler drunk with power and lust, and Kwon-yoo, who has everything to lose if his desire for Hwa-yeon is exposed.",ko,2012
4108,The Transporter,2002-10-02,7.7727,6.721,5787,"[28, 80, 53]","Former Special Forces officer Frank Martin will deliver anything to anyone for the right price, and his no-questions-asked policy puts him in high demand. But when he realizes his latest cargo is alive, it sets in motion a dangerous chain of events. The bound and gagged Lai is being smuggled to France by a shady American businessman, and Frank works to save her as his own illegal activities are uncovered by a French detective.",en,2002
337170,American Made,2017-08-18,7.4253,6.903,4958,"[35, 80, 18]","The true story of pilot Barry Seal, who transported contraband for the CIA and the Medellin cartel in the 1980s.",en,2017
9476,A Knight's Tale,2001-05-11,6.8723,6.9,3367,"[12, 18, 10749, 28]","William Thatcher, a knight's peasant apprentice, gets a chance at glory when the knight dies suddenly mid-tournament. Posing as a knight himself, William won't stop until he's crowned tournament champion—assuming matters of the heart don't get in the way.",en,2001
71672,Wrong Turn 4: Bloody Beginnings,2011-10-17,7.4454,5.724,1206,"[27, 53]","A group of friends take refuge in a deserted sanatorium after they are left stranded in a snowstorm. Later, the place becomes a death trap when man-eating cannibals surround them.",en,2011
9702,Bound by Honor,1993-02-05,7.0988,8.141,1513,"[80, 18, 53]","Based on the true life experiences of poet Jimmy Santiago Baca, the film focuses on half-brothers Paco and Cruz, and their bi-racial cousin Miklo. It opens in 1972, as the three are members of an East L.A. gang known as the ""Vatos Locos"", and the story focuses on how a violent crime and the influence of narcotics alter their lives. Miklo is incarcerated and sent to San Quentin, where he makes a ""home"" for himself. Cruz becomes an exceptional artist, but a heroin addiction overcomes him with tragic results. Paco becomes a cop and an enemy to his ""carnal"", Miklo.",en,1993
297761,Suicide Squad,2016-08-03,7.3564,5.917,22037,"[28, 12, 14]","From DC Comics comes the Suicide Squad, an antihero team of incarcerated supervillains who act as deniable assets for the United States government, undertaking high-risk black ops missions in exchange for commuted prison sentences.",en,2016
1372,Blood Diamond,2006-12-08,7.4754,7.556,8284,"[18, 53, 28]","An ex-mercenary turned smuggler. A Mende fisherman. Amid the explosive civil war overtaking 1999 Sierra Leone, these men join for two desperate missions: recovering a rare pink diamond of immense value and rescuing the fisherman's son, conscripted as a child soldier into the brutal rebel forces ripping a swath of torture and bloodshed countrywide.",en,2006
10693,Peter Pan,1953-02-05,8.063,7.189,5723,"[16, 10751, 12, 14]","Leaving the safety of their nursery behind, Wendy, Michael and John follow Peter Pan to a magical world where childhood lasts forever. But while in Neverland, the kids must face Captain Hook and foil his attempts to get rid of Peter for good.",en,1953
158852,Tomorrowland,2015-05-19,7.299,6.291,7334,"[12, 10751, 9648, 878]","Bound by a shared destiny, a bright, optimistic teen bursting with scientific curiosity and a former boy-genius inventor jaded by disillusionment embark on a danger-filled mission to unearth the secrets of an enigmatic place somewhere in time and space that exists in their collective memory as ""Tomorrowland.""",en,2015
22970,The Cabin in the Woods,2012-04-12,7.3574,6.648,8493,"[27, 9648, 35]","Five friends set out for a weekend at a remote cabin in the woods, expecting nothing more than fun and relaxation. As night falls, they discover that something far more unsettling is at work and that nothing about their getaway is what it seems.",en,2012
338970,Tomb Raider,2018-03-05,7.4933,6.364,8323,"[28, 12, 14]","Lara Croft, the fiercely independent daughter of a missing adventurer, must push herself beyond her limits when she finds herself on the island where her father disappeared.",en,2018
4233,Scream 2,1997-12-12,7.5296,6.515,4699,"[27, 9648]","Two years after the Woodsboro murders, Sidney Prescott acclimates to college life while someone donning the Ghostface costume begins a new string of killings.",en,1997
764,The Evil Dead,1981-10-15,7.7672,7.275,4439,[27],"In 1979, a group of college students find a Sumerian Book of the Dead in an old wilderness cabin they've rented for a weekend getaway.",en,1981
