id,title,release_date,popularity,vote_average,vote_count,genre_ids,overview,original_language,release_year
4561,The Story of O,1975-08-27,6.4436,5.525,178,[18],"The beautiful O is taken by her boyfriend, Rene, to a bizarre retreat, where she is trained in bondage and sexual perversion...",fr,1975
1452,Superman Returns,2006-06-28,6.4962,5.803,4538,"[878, 28, 12]","Superman returns to discover his 5-year absence has allowed Lex Luthor to walk free, and that those he was closest to felt abandoned and have moved on. Luthor plots his ultimate revenge that could see millions killed and change the face of the planet forever, as well as ridding himself of the Man of Steel.",en,2006
109689,I Want You,2012-06-22,6.5529,7.446,1954,"[18, 10749]","After two years away, Hache returns to Barcelona seeking a fresh start. Falling for Gin while facing unresolved feelings for Babi, he must confront love, loss, and who he's becoming.",es,2012
302699,Central Intelligence,2016-06-15,6.3876,6.414,6326,"[28, 35]","Calvin Joyner, a mild-mannered accountant whose high school glory days are long behind him, reconnects with an awkward pal from high school through Facebook. After meeting up, Calvin’s mundane life takes an unexpectedly thrilling turn when he's thrust into the world of international espionage.",en,2016
840705,Blink Twice,2024-08-21,6.2609,6.681,1871,"[9648, 53]","When tech billionaire Slater King meets cocktail waitress Frida at his fundraising gala, he invites her to join him and his friends on a dream vacation on his private island. But despite the epic setting, beautiful people, ever-flowing champagne, and late-night dance parties, Frida can sense that there’s something sinister hiding beneath the island’s lush façade.",en,2024
20504,The Book of Eli,2010-01-14,6.5164,6.8,6644,"[28, 53, 878]","A post-apocalyptic tale, in which a lone man fights his way across America in order to protect a sacred book that holds the secrets to saving humankind.",en,2010
865,The Running Man,1987-11-13,5.9577,6.544,2818,"[28, 53, 878]","By 2017, the global economy has collapsed and U.S. society has become a totalitarian police state, censoring all cultural activity. The government pacifies the populace by broadcasting a number of game shows in which convicted criminals fight for their lives, including the gladiator-style The Running Man, hosted by the ruthless Damon Killian, where “runners” attempt to evade “stalkers” and certain death for a chance to be pardoned and set free.",en,1987
339964,Valerian and the City of a Thousand Planets,2017-07-19,6.2839,6.631,7957,"[12, 878, 28]","In the 28th century, Valerian and Laureline are special operatives charged with keeping order throughout the human territories. On assignment from the Minister of Defense, the two undertake a mission to Alpha, an ever-expanding metropolis where species from across the universe have converged over centuries to share knowledge, intelligence, and cultures. At the center of Alpha is a mysterious dark force which threatens the peaceful existence of the City of a Thousand Planets, and Valerian and Laureline must race to identify the menace and safeguard not just Alpha, but the future of the universe.",en,2017
454,Romeo + Juliet,1996-11-01,6.6612,6.8,5331,"[18, 10749]","In this contemporary take on William Shakespeare's classic tragedy, the Montagues and Capulets have moved their ongoing feud to the sweltering suburb of Verona Beach, where Romeo and Juliet fall in love and secretly wed. Though the film is visually modern, the bard's dialogue remains.",en,1996
296099,Vacation,2015-07-28,7.0133,6.305,3965,"[35, 12]","Hoping to bring his family closer together and to recreate his childhood vacation for his own kids, a grown up Rusty Griswold takes his wife and their two sons on a cross-country road trip to the coolest theme park in America, Walley World. Needless to say, things don't go quite as planned.",en,2015
1100099,We Live in Time,2024-10-10,6.8307,7.2,1259,"[10749, 18]","An up-and-coming chef and a recent divorcée find their lives forever changed when a chance encounter brings them together, in a decade-spanning, deeply moving romance.",en,2024
139038,A Haunted House,2013-01-11,5.8168,5.946,2040,"[35, 27]","Malcolm and Kisha move into their dream home, but soon learn a demon also resides there. When Kisha becomes possessed, Malcolm - determined to keep his sex life on track - turns to a priest, a psychic, and a team of ghost-busters for help in this spoof of all the ""found-footage/documentary style"" films released in recent years.",en,2013
451156,Infidelity in Suburbia,2017-02-25,6.7865,6.2,156,"[53, 10770]","With her husband away at work, and her son at school, Laura dreams of a home-renovation project to supplant her restless days. Elliott, her irresistibly hot private contractor, soon fulfills her more forbidden dreams.",en,2017
448119,Dolittle,2020-01-02,6.5654,6.577,3859,"[10751, 35, 14, 12]","After losing his wife seven years earlier, the eccentric Dr. John Dolittle, famed doctor and veterinarian of Queen Victoria’s England, hermits himself away behind the high walls of Dolittle Manor with only his menagerie of exotic animals for company. But when the young queen falls gravely ill, a reluctant Dolittle is forced to set sail on an epic adventure to a mythical island in search of a cure, regaining his wit and courage as he crosses old adversaries and discovers wondrous creatures.",en,2020
205587,The Judge,2014-10-08,6.7133,7.331,4411,[18],"A successful lawyer returns to his hometown for his mother's funeral only to discover that his estranged father, the town's judge, is suspected of murder.",en,2014
458723,Us,2019-03-14,6.7065,6.949,8023,"[27, 9648]","Husband and wife Gabe and Adelaide Wilson take their kids to their beach house expecting to unplug and unwind with friends. But as night descends, their serenity turns to tension and chaos when some shocking visitors arrive uninvited.",en,2019
265208,Wild Card,2015-01-14,5.8972,5.699,1930,"[53, 80, 28]","When a Las Vegas bodyguard with lethal skills and a gambling problem gets in trouble with the mob, he has one last play… and it's all or nothing.",en,2015
9823,Mortal Kombat: Annihilation,1997-11-11,7.9456,4.5,1317,"[28, 14, 878]","A group of heroic warriors has only six days to save the planet in ""Mortal Kombat Annihilation."" To succeed they must survive the most spectacular series of challenges any human, or god, has ever encountered as they battle an evil warlord bent on taking control of Earth.",en,1997
645886,The Unforgivable,2021-11-24,6.1398,7.41,2031,"[18, 80]",A woman is released from prison after serving a sentence for a violent crime and re-enters a society that refuses to forgive her past.,en,2021
840430,The Holdovers,2023-10-27,5.8142,7.652,2473,"[18, 35]","A curmudgeonly instructor at a New England prep school is forced to remain on campus during Christmas break to babysit the handful of students with nowhere to go. Eventually, he forms an unlikely bond with one of them — a damaged, brainy troublemaker — and with the school’s head cook, who has just lost a son in Vietnam.",en,2023
7980,The Lovely Bones,2009-12-26,6.327,7.06,4915,"[14, 18]","After being brutally murdered, 14-year-old Susie Salmon watches from heaven over her grief-stricken family -- and her killer. As she observes their daily lives, she must balance her thirst for revenge with her desire for her family to heal.",en,2009
187,Sin City,2005-04-01,5.9019,7.464,8791,"[80, 53]","Welcome to Sin City. This town beckons to the tough, the corrupt, the brokenhearted. Some call it dark… Hard-boiled. Then there are those who call it home — Crooked cops, sexy dames, desperate vigilantes. Some are seeking revenge, others lust after redemption, and then there are those hoping for a little of both. A universe of unlikely and reluctant heroes still trying to do the right thing in a city that refuses to care.",en,2005
842675,The Wandering Earth II,2023-01-22,6.1203,7.299,710,"[878, 28, 12]","Humans built huge engines on the surface of the earth to find a new home. But the road to the universe is perilous. In order to save earth, young people once again have to step forward to start a race against time for life and death.",zh,2023
700391,65,2023-03-02,7.2797,5.948,2819,"[28, 12, 878]","65 million years ago, the only 2 survivors of a spaceship from Somaris that crash-landed on Earth, must fend off dinosaurs to reach the escape vessel in time before an imminent asteroid strike threatens to destroy the planet.",en,2023
1268,Mr. Bean's Holiday,2007-03-22,6.4452,6.384,3095,"[10751, 35]","Mr. Bean wins a trip to Cannes where he unwittingly separates a young boy from his father and must help the two reunite. On the way he discovers France, bicycling and true love, among other things.",en,2007
9336,Police Academy,1984-03-22,6.6035,6.7,2973,"[35, 80]","New rules enforced by the Lady Mayoress mean that sex, weight, height and intelligence need no longer be a factor for joining the Police Force. This opens the floodgates for all and sundry to enter the Police Academy, much to the chagrin of the instructors. Not everyone is there through choice, though. Social misfit Mahoney has been forced to sign up as the only alternative to a jail sentence and it doesn't take long before he falls foul of the boorish Lieutenant Harris. But before long, Mahoney realises that he is enjoying being a police cadet and decides he wants to stay... while Harris decides he wants Mahoney out!",en,1984
8095,Cleopatra,1963-06-12,6.2786,7.052,844,"[18, 36, 10749]","Determined to hold on to the throne, Cleopatra seduces the Roman emperor Julius Caesar. When Caesar is murdered, she redirects her attentions to his general, Marc Antony, who vows to take power—but Caesar’s successor has other plans.",en,1963
228161,Home,2015-03-18,6.5831,6.789,4200,"[14, 35, 16, 878, 10751]","When Earth is taken over by the overly-confident Boov, an alien race in search of a new place to call home, all humans are promptly relocated, while all Boov get busy reorganizing the planet. But when one resourceful girl, Tip, manages to avoid capture, she finds herself the accidental accomplice of a banished Boov named Oh. The two fugitives realize there’s a lot more at stake than intergalactic relations as they embark on the road trip of a lifetime.",en,2015
49797,I Saw the Devil,2010-08-12,7.401,7.797,2987,"[53, 27]","Kyung-chul is a dangerous psychopath who kills for pleasure. Soo-hyeon, a top-secret agent, decides to track down the murderer himself. He promises himself that he will do everything in his power to take vengeance against the killer, even if it means that he must become a monster himself.",ko,2010
9373,The Texas Chainsaw Massacre,2003-05-21,6.7679,6.304,2885,[27],"After picking up a traumatized young hitchhiker, five friends find themselves stalked and hunted by a chainsaw-wielding killer and his family of equally psychopathic killers.",en,2003
1300116,Fall for Me,2025-08-20,6.5849,6.1,219,"[10749, 53]","Lilli is suspicious of her sister's new fiance, but when an attractive stranger enters her life, she's suddenly distracted by the thralls of desire.",de,2025
41630,No Strings Attached,2011-01-21,6.0868,6.295,4972,"[35, 10749]","Emma is a busy doctor who sets up a seemingly perfect arrangement when she offers her best friend Adam a relationship with one rule: No strings attached. But when a fling becomes a thing, can sex friends stay best friends?",en,2011
1104844,BLUE LOCK THE MOVIE -EPISODE NAGI-,2024-04-19,6.7793,7.409,225,"[16, 28, 18]","When apathetic gamer Nagi agrees to join his rich classmate Mikage in soccer, their partnership leads to the famous Blue Lock program — and to changes.",ja,2024
11845,Intimacy,2001-01-20,7.3715,6.252,548,"[10749, 18, 14]","Failed musician Jay abandoned his family and now earns a living as head bartender in a trendy London pub. Every Wednesday afternoon, a woman comes to his house for graphic, almost wordless, sex. One day, Jay follows her and learns about her. This eventually disrupts their relationship.",en,2001
960292,My Sole Desire,2023-04-05,6.2376,6.519,107,"[10749, 18]","When aimless Manon begins work at À mon seul désir, a strip club that offers high concept performances, she instantly bonds with her fellow strippers, particularly Mia, an aspiring actress with a boyfriend and child. Manon learns that it is “not easy money, but fast money” and when she finds herself falling for Mia, she is forced to question her priorities as she explores her newfound erotic life.",fr,2023
947,Lawrence of Arabia,1962-12-11,5.963,7.997,3399,"[12, 36, 10752]","During World War I, English officer Thomas Edward 'T.E.' Lawrence sets out to unite and lead the diverse, often warring, Arab tribes to fight the Turks.",en,1962
311324,The Great Wall,2016-12-16,6.7493,6.027,5511,"[28, 12, 14]",European mercenaries searching for black powder become embroiled in the defense of the Great Wall of China against a horde of monstrous creatures.,en,2016
341174,Fifty Shades Darker,2017-02-08,6.3919,6.472,7919,"[18, 10749]","When a wounded Christian Grey tries to entice a cautious Ana Steele back into his life, she demands a new arrangement before she will give him another chance. As the two begin to build trust and find stability, shadowy figures from Christian’s past start to circle the couple, determined to destroy their hopes for a future together.",en,2017
357096,I Spit on Your Grave III: Vengeance Is Mine,2015-10-01,5.9021,5.779,1055,[27],"Jennifer Hills is still tormented by the brutal sexual assault she endured years ago. She’s changed identities and cities, reluctantly joining a support group where she begins to piece together a new life. But when her new friend’s murderer goes free and the tales of serial rapists haunt her, Jennifer will hunt down the men responsible and do what the system won’t – make them pay for their crimes in the most horrific ways imaginable. Only this time, no jury may be able to save her.",en,2015
11621,Porco Rosso,1992-07-18,6.7636,7.797,3699,"[16, 12, 14]","In Italy in the 1930s, sky pirates in biplanes terrorize wealthy cruise ships as they sail the Adriatic Sea. The only pilot brave enough to stop the scourge is the mysterious Porco Rosso, a former World War I flying ace who was somehow turned into a pig during the war. As he prepares to battle the pirate crew's American ace, Porco Rosso enlists the help of spunky girl mechanic Fio Piccolo and his longtime friend Madame Gina.",ja,1992
36586,Blade II,2002-03-22,6.6404,6.558,5173,"[14, 27, 28, 53]","Blade forms an uneasy alliance with the vampire council in order to combat the Reapers, who are feeding on vampires.",en,2002
744276,After Ever Happy,2022-08-24,6.6584,6.769,1364,"[10749, 18]","As a shocking truth about a couple's families emerges, the two lovers discover they are not so different from each other. Tessa is no longer the sweet, simple, good girl she was when she met Hardin — any more than he is the cruel, moody boy she fell so hard for.",en,2022
64686,47 Ronin,2013-12-06,6.5684,6.202,4117,"[18, 28, 14]","Kai—an outcast—joins Oishi, the leader of 47 outcast samurai.  Together they seek vengeance upon the treacherous overlord who killed their master and banished their kind.  To restore honour to their homeland, the warriors embark upon a quest that challenges them with a series of trials that would destroy ordinary warriors.",en,2013
9462,The Way of the Dragon,1972-12-30,6.8825,7.37,1280,"[28, 80]","After a Chinese restaurant in Rome is threatened by the mafia, who will stop at nothing to acquire the property, the owner recruits a family friend in Hong Kong, kung fu expert Tang Lung, to help them defend their business.",cn,1972
487616,Curiosa,2019-04-03,6.6679,5.8,241,"[18, 36]","A passionate love story set against a backdrop of sexual freedom, loosely based on the relationship between 19th century authors Pierre Louÿs and Marie de Régnier.",fr,2019
2675,Signs,2002-08-02,6.6217,6.698,6224,"[53, 878, 27]",A family living on a farm finds mysterious crop circles in their fields which suggests something more frightening to come.,en,2002
2259,The House of the Spirits,1993-10-21,6.231,6.943,734,"[10749, 18]","A rancher, his clairvoyant wife and their family face turbulent years in South America.",en,1993
76025,Shame,2011-10-02,6.2974,6.925,3393,[18],"Brandon, a thirty-something man living in New York, eludes intimacy with women but feeds his deepest desires with a compulsive addiction to sex. When his younger sister temporarily moves into his apartment, stirring up bitter memories of their shared painful past, Brandon's life, like his fragile mind, gets out of control.",en,2011
3114,The Searchers,1956-05-16,5.4945,7.692,1565,[37],"As a Civil War veteran spends years searching for a young niece captured by Indians, his motivation becomes increasingly questionable.",en,1956
900667,One Piece Film Red,2022-08-06,6.1638,7.2,1120,"[16, 12, 28, 14]",A new adventure begins for Luffy and his crew when mysterious pop superstar Uta unveils her identity — and launches a misguided plan for world peace.,ja,2022
334533,Captain Fantastic,2016-07-08,5.9541,7.889,6809,"[12, 18]","Deep in the forests of the Pacific Northwest, a father devoted to raising his six kids with a rigorous physical and intellectual education is forced to leave his paradise and enter the world, beginning a journey that challenges his idea of what it means to be a parent.",en,2016
1242434,Highest 2 Lowest,2025-08-14,6.0245,5.514,462,"[53, 80, 18]","When a titan music mogul, widely known as having the ""best ears in the business"", is targeted with a ransom plot, he is jammed up in a life-or-death moral dilemma.",en,2025
930564,Saltburn,2023-11-16,6.5486,6.956,2900,"[18, 35, 53]","Struggling to find his place at Oxford University, student Oliver Quick finds himself drawn into the world of the charming and aristocratic Felix Catton, who invites him to Saltburn, his eccentric family's sprawling estate, for a summer never to be forgotten.",en,2023
6282,Coyote Ugly,2000-07-30,6.6599,6.263,2265,"[35, 18, 10402, 10749]","Graced with a velvet voice, 21-year-old Violet Sanford heads to New York to pursue her dream of becoming a songwriter only to find her aspirations sidelined by the accolades and notoriety she receives at her ""day"" job as a barmaid at Coyote Ugly. The ""Coyotes"" as they are affectionately called tantalize customers and the media alike with their outrageous antics, making Coyote Ugly the watering hole for guys on the prowl.",en,2000
301337,Downsizing,2017-12-22,5.1107,5.404,4093,"[18, 878, 35]",A kindly occupational therapist undergoes a new procedure to be shrunken to four inches tall so that he and his wife can help save the planet and afford a nice lifestyle at the same time.,en,2017
1088166,Relay,2025-08-21,5.9589,6.924,401,"[28, 18, 53]",A broker of lucrative payoffs between corrupt corporations and the individuals who threaten them breaks his own rules when a new client seeks his protection to stay alive.,en,2025
5255,The Polar Express,2004-11-10,6.6632,6.723,6853,"[12, 16, 10751, 14]","When a doubting young boy takes an extraordinary train ride to the North Pole, he embarks on a journey of self-discovery that shows him that the wonder of life never fades for those who believe.",en,2004
13207,Friday the 13th,2009-02-11,6.4057,5.774,2843,"[27, 53]",A group of young adults visit a boarded up campsite named Crystal Lake where they soon encounter the mysterious Jason Voorhees and his deadly intentions.,en,2009
65754,The Girl with the Dragon Tattoo,2011-12-14,6.3367,7.384,7565,"[53, 80, 9648]","Disgraced journalist Mikael Blomkvist investigates the disappearance of a weary patriarch's niece from 40 years ago. He is aided by the pierced, tattooed, punk computer hacker named Lisbeth Salander. As they work together in the investigation, Blomkvist and Salander uncover immense corruption beyond anything they have ever imagined.",en,2011
9539,Martyrs,2008-06-12,6.592,7.306,3009,"[27, 18, 53]","A young woman’s quest for revenge against the people who kidnapped and tortured her as a child leads her and her best friend, also a victim of child abuse, on a terrifying journey into a living hell of depravity.",fr,2008
1948,Crank,2006-08-31,6.9263,6.653,4184,"[28, 53, 80]","Chev Chelios, a hit man wanting to go straight, lets his latest target slip away. Then he awakes the next morning to a phone call that informs him he has been poisoned and has only an hour to live unless he keeps adrenaline coursing through his body while he searches for an antidote.",en,2006
35019,Nanny McPhee and the Big Bang,2010-03-26,7.0449,6.315,1940,"[35, 14, 10751]","Nanny McPhee appears at the door of a harried young mother who is trying to run the family farm while her husband is away at war. But once she’s arrived, Nanny discovers that the children are fighting a war of their own against two spoiled city cousins who have just moved in. Relying on everything from a flying motorcycle and a statue that comes to life to a tree-climbing piglet and a baby elephant, Nanny uses her magic to teach her mischievous charges five new lessons.",en,2010
8275,American Pie Presents: The Naked Mile,2006-12-13,6.7394,5.487,2179,[35],"When Erik Stifler realizes that he's the only Stifler family member who might graduate high school a virgin, he decides to live up to his legacy. After some well-meaning advice from Jim's dad, Erik's ready to take his chances at the annual and infamous Naked Mile race, where his devoted friends and some uninhibited sorority girls will create the most outrageous weekend ever.",en,2006
1290159,A House of Dynamite,2025-10-02,6.6236,6.407,1214,[53],"When a single, unattributed missile is launched at the United States, a race begins to determine who is responsible and how to respond.",en,2025
705861,Hustle,2022-06-03,6.8652,7.704,2811,"[18, 35]","After discovering a once-in-a-lifetime player with a rocky past abroad, a down on his luck basketball scout takes it upon himself to bring the phenom to the States without his team's approval. Against the odds, they have one final shot to prove they have what it takes to make it in the NBA.",en,2022
1139087,Once Upon a Studio,2023-09-24,5.745,8.265,425,"[16, 10751, 14, 18, 35]","Created for Disney's 100th anniversary, the short features Mickey Mouse corralling a gallery of legendary Disney characters for a group photo.",en,2023
72784,The Loft,2014-10-14,7.0165,6.409,1561,[53],"For five men, the opportunity to share a penthouse in the city -- in which to carry on extramarital affairs -- is a dream come true, until the dead body of an unknown woman turns up. Realizing that her killer must be one of their group, the men are gripped by paranoia as each one suspects another.",en,2014
8922,Jeepers Creepers,2001-07-01,6.1705,6.473,3259,[27],"On a desolate country highway, two homeward-bound teens are nearly run off the road by a maniac in a beat-up truck, and later spot him shoving what appears to be a body down a sewer pipe.",en,2001
3981,What Women Want,2000-12-15,6.3114,6.452,4359,"[35, 10749]","Advertising executive Nick Marshall is as cocky as they come, but what happens to a chauvinistic guy when he can suddenly hear what women are thinking? Nick gets passed over for a promotion, but after an accident enables him to hear women's thoughts, he puts his newfound talent to work against Darcy, his new boss, who seems to be infatuated with him.",en,2000
11430,The Lion King 1½,2004-10-28,6.4895,6.581,3136,"[12, 16, 35, 10751]",Timon the meerkat and Pumbaa the warthog are best pals and the unsung heroes of the African savanna. This prequel to the smash Disney animated adventure takes you back -- way back -- before Simba's adventure began. You'll find out all about Timon and Pumbaa and tag along as they search for the perfect home and attempt to raise a rambunctious lion cub.,en,2004
1291559,Drawing Closer,2024-06-26,6.333,8.368,204,"[10749, 18]","With only a year left to live, 17-year-old Akito finds new meaning in life by bringing joy to a terminally ill girl who has just six months remaining.",ja,2024
549509,The Brutalist,2024-12-20,6.2435,6.954,1627,[18],"When an innovative modern architect flees post-war Europe, he is given the opportunity to rebuild his legacy. Set during the dawn of the modern United States (in Pennsylvania), his wife joins him, and their lives are forever changed by a demanding, wealthy patron.",en,2024
13576,This Is It,2009-10-28,6.6258,7.19,982,"[10402, 99]","A compilation of interviews, rehearsals and backstage footage of Michael Jackson as he prepared for his series of sold-out shows in London.",en,2009
301,Rio Bravo,1959-03-08,5.6003,7.8,1260,"[37, 18]","A small-town sheriff in the American West enlists the help of a disabled man, a drunk, and a young gunfighter in his efforts to hold in jail the brother of the local bad guy.",en,1959
966,The Magnificent Seven,1960-10-12,6.5951,7.5,1972,"[37, 28, 12]",An oppressed Mexican peasant village hires seven gunfighters to help defend their homes.,en,1960
752623,The Lost City,2022-03-23,6.5066,6.46,3965,"[28, 12, 35]","Reclusive author Loretta Sage writes about exotic places in her popular adventure novels that feature a handsome cover model named Alan. While on tour promoting her new book with Alan, Loretta gets kidnapped by an eccentric billionaire who hopes she can lead him to the ancient city's lost treasure that featured in her latest story. Alan, determined to prove he can be a hero in real life and not just on the pages of her books, sets off to rescue her.",en,2022
315837,Ghost in the Shell,2017-03-29,6.833,6.107,8537,"[878, 18, 28]","In the near future, Major is the first of her kind: a human saved from a terrible crash, then cyber-enhanced to be a perfect soldier devoted to stopping the world's most dangerous criminals.",en,2017
